title,url,thumbnail_url,channel,description
"Aashiqui Aa Gayi Song | Radhe Shyam | Prabhas, Pooja Hegde | Mithoon, Arijit Singh | Bhushan K",https://www.youtube.com/watch?v=c-NaCU2n8jg,https://i.ytimg.com/vi/c-NaCU2n8jg/hqdefault.jpg?sqp=-oaymwEcCPYBEIoBSFXyq4qpAw4IARUAAIhCGAFwAcABBg==&rs=AOn4CLARl-an4jT473D9Ll5zesqxM8fXyQ,T-Series,"Presenting first song 'Aashiqui Aa Gayi' from the movie #RadheShyam Gulshan Kumar and Bhushan Kumar present UV Creations in association with T-Series presents ""Radhe Shyam"". Multi-Lingual..."
"Dhee 13 | Kings vs Queens | Sudheer,Rashmi,Pradeep,Aadi| 1st December 2021 | Full Episode|ETV Telugu",https://www.youtube.com/watch?v=RE-xp16EFXM,https://i.ytimg.com/vi/RE-xp16EFXM/hqdefault.jpg?sqp=-oaymwEcCPYBEIoBSFXyq4qpAw4IARUAAIhCGAFwAcABBg==&rs=AOn4CLCc6moqjsRGXK4FdBRAEwQZvsRkkA,ETV Dhee,#dhee #dhee13 #dhee13kingsvsqueens #etvtelugu #etvwin #sudigaalisudheer #rashmi #pradeepmachiraju #hyperaadi #deepikapilli #ganeshmaster #poorna #priyamani #Karthik #Dhee13GrandFinale #Nainika...
"Unstoppable Ep 3 Promo | Balakrishna | Brahmanandam, Anil Ravipudi |An aha Original |Premieres Dec 3",https://www.youtube.com/watch?v=y1rAE1qKDio,https://i.ytimg.com/vi/y1rAE1qKDio/hqdefault.jpg?sqp=-oaymwEcCPYBEIoBSFXyq4qpAw4IARUAAIhCGAFwAcABBg==&rs=AOn4CLDOSBg088B_BHsyvdsKD4w5zEvEbA,aha videoIN,"Mundundi Navvula Pandaga 😃 Meanwhile, enjoy this FUNtastic Promo 😉 ▶️ https://watch.aha.video/USEp3Promo #UnstoppableWithNBK Ep 3 Premieres Dec 3rd. #NandamuriBalakrishna #Brahmanandam..."
E video chudandi,https://www.youtube.com/watch?v=kiujX2Fz2_k,https://i.ytimg.com/vi/kiujX2Fz2_k/hqdefault.jpg?sqp=-oaymwEcCPYBEIoBSFXyq4qpAw4IARUAAIhCGAFwAcABBg==&rs=AOn4CLABcD9AhXCfXZ56hCYpf06hYFYoAA,vizagsmileofficial channel,e video chudandi #telugu #shorts #video #saleem #viral #tranding
MISunderstanding || Episode - 3 || Dorasai Teja || Varsha Dsouza || Tej India || Infinitum Media,https://www.youtube.com/watch?v=tTEc1OZQyc0,https://i.ytimg.com/vi/tTEc1OZQyc0/hqdefault.jpg?sqp=-oaymwEcCPYBEIoBSFXyq4qpAw4IARUAAIhCGAFwAcABBg==&rs=AOn4CLDWyTefxKd0Od7bLguUdvVh1qqivw,Tej India,Play 100+ Games & Win Cash Daily. Get Rs 50 free on WinZO Download WinZO: https://winzo.onelink.me/VS3O/abd2e374 Via - viralzone.media Ajju and Shreya are back to show you the 2 sides of...
friend tho friend,https://www.youtube.com/watch?v=CRFE8ZHNpys,,vizagsmileofficial channel,#telugu #shorts #saleem #funny #comedy
83 | Official Trailer | Hindi | Ranveer Singh | Kabir Khan | IN CINEMAS 24TH DEC,https://www.youtube.com/watch?v=QHdkC6Kn0Io,,Reliance Entertainment,"Presenting the official trailer of 83 (Hindi), Directed By Kabir Khan. Celebrated by Mobil. #ThisIs83 On 25th of June 1983, the Lord’s Cricket Ground witnessed one of the biggest underdog..."
Akhanda - Dialogue Promo 8 | Nandamuri Balakrishna | Boyapati Srinu | Thaman S | Dec 2nd,https://www.youtube.com/watch?v=A91O3xWpKj4,,Dwaraka Creations,"Akhanda Dialogue Promo 8 on Dwaraka Creations. Akhanda is a Latest Telugu Movie starring Nandamuri Balakrishna, Pragya Jaiswal, JagapathiBabu, Srikanth. Directed by Boyapati Srinu. Music by..."
"Acharya - Siddha's Saga Teaser | Megastar Chiranjeevi, Megapowerstar Ram Charan | Koratala Siva",https://www.youtube.com/watch?v=5vcdMXJQebk,,Matinee Entertainment,"Presenting Siddha's Saga Teaser from Acharya Movie: #Acharya Starring: Megastar #Chiranjeevi, Megapowerstar #RamCharan, Pooja Hegde, Kajal Agarwal. Written & Directed by Koratala..."
నేను చేసిన పాయ రోటి || Zubeda Ali || Actor Ali,https://www.youtube.com/watch?v=E_jxiaoBiEk,,Zubeda Ali,"For Binomo Education, Click https://binomoindia.in/ZUBEDA_ALI and get Rs.65,000 for Binomo tutorial. Use ADV101 promo code for +100% on the first deposit. Thank me later! Risk Warning! Your..."
